{
  "urn": "cap:in=\"media:rst;textable\";op=extract_metadata;out=\"media:file-metadata;textable;record\"",
  "command": "extract-metadata",
  "title": "Extract RST Metadata",
  "cap_description": "Extract RST document metadata including title, file size, word count, and other properties",
  "metadata": {},
  "args": [
    {
      "media_urn": "media:file-path;textable",
      "required": true,
      "sources": [
        {
          "stdin": "media:rst;textable"
        },
        {
          "position": 0
        }
      ],
      "arg_description": "Path to the RST file to process"
    }
  ],
  "output": {
    "media_urn": "media:textable;record",
    "output_description": "Structured metadata including file properties and RST-specific metadata"
  }
}