{
  "urn": "cap:candle;in=\"media:image;png\";ml-model;op=describe_image;out=\"media:image-description;textable\"",
  "command": "describe_image",
  "title": "Describe Image (Candle)",
  "cap_description": "Generate image descriptions using BLIP models with Candle ML framework",
  "metadata": {},
  "args": [
    {
      "media_urn": "media:file-path;textable",
      "required": true,
      "sources": [
        {
          "stdin": "media:image;png"
        },
        {
          "position": 0
        }
      ],
      "arg_description": "Path to the image file to describe"
    },
    {
      "media_urn": "media:prompt;textable",
      "required": false,
      "sources": [
        {
          "cli_flag": "--prompt"
        }
      ],
      "arg_description": "Optional prompt to guide the image description"
    },
    {
      "media_urn": "media:model-spec;textable",
      "required": false,
      "sources": [
        {
          "cli_flag": "--model"
        }
      ],
      "arg_description": "BLIP model name from HuggingFace",
      "default_value": "hf:Salesforce/blip-image-captioning-large"
    }
  ],
  "output": {
    "media_urn": "media:image-description;textable",
    "output_description": "Generated text description of the image"
  }
}