{
  "urn": "cap:in=\"media:model-repo;textable;record\";op=list-models;out=\"media:model-list;textable;record\"",
  "command": "list",
  "title": "List Models",
  "cap_description": "List all locally cached models.",
  "metadata": {},
  "args": [
    {
      "media_urn": "media:model-repo;textable;record",
      "required": false,
      "sources": [
        {
          "stdin": "media:model-repo;textable;record"
        }
      ]
    }
  ],
  "output": {
    "media_urn": "media:model-list;textable;record",
    "output_description": "List of models with their metadata and status"
  }
}