{
  "urn": "cap:in=media:pdf;op=extract_metadata;out=\"media:file-metadata;textable;record\"",
  "command": "extract-metadata",
  "title": "Extract PDF Metadata",
  "cap_description": "Extract PDF document metadata including title, author, creation date, file size, and other properties",
  "metadata": {},
  "args": [
    {
      "media_urn": "media:file-path;textable",
      "required": true,
      "sources": [
        {
          "stdin": "media:pdf"
        },
        {
          "position": 0
        }
      ],
      "arg_description": "Path to the document file to process"
    }
  ],
  "output": {
    "media_urn": "media:file-metadata;textable;record",
    "output_description": "Structured metadata including file properties, document properties, and format-specific metadata"
  }
}