{
  "urn": "cap:in=\"media:rst;textable\";op=generate_thumbnail;out=\"media:image;png;thumbnail\"",
  "command": "generate-thumbnail",
  "title": "Generate RST Thumbnail",
  "cap_description": "Generate a thumbnail image preview of the RST document",
  "metadata": {},
  "args": [
    {
      "media_urn": "media:file-path;textable",
      "required": true,
      "sources": [
        {
          "stdin": "media:rst;textable"
        },
        {
          "position": 0
        }
      ],
      "arg_description": "Path to the RST file to process"
    },
    {
      "media_urn": "media:thumbnail-width;textable;numeric",
      "required": false,
      "sources": [
        {
          "cli_flag": "--width"
        }
      ],
      "arg_description": "Width of the thumbnail in pixels",
      "default_value": 200
    },
    {
      "media_urn": "media:thumbnail-height;textable;numeric",
      "required": false,
      "sources": [
        {
          "cli_flag": "--height"
        }
      ],
      "arg_description": "Height of the thumbnail in pixels",
      "default_value": 300
    }
  ],
  "output": {
    "media_urn": "media:image;png;thumbnail",
    "output_description": "PNG image data representing a thumbnail of the RST document"
  }
}