{
  "urn": "cap:constrained;in=media:textable;language=en;op=choose_bits;out=\"media:decision;bool;textable;list\"",
  "command": "bit_choices",
  "title": "Make Multiple Choices",
  "cap_description": "Make multiple binary (yes/no, true/false) decisions based on content and multiple questions",
  "metadata": {},
  "args": [
    {
      "media_urn": "media:textable",
      "required": true,
      "sources": [
        {
          "stdin": "media:textable"
        },
        {
          "position": 0
        }
      ],
      "arg_description": "Content to analyze for the binary decisions"
    },
    {
      "media_urn": "media:question;textable;list",
      "required": true,
      "sources": [
        {
          "cli_flag": "--questions"
        }
      ],
      "arg_description": "Array of binary questions to answer about the content"
    },
    {
      "media_urn": "media:language-code;textable",
      "required": false,
      "sources": [
        {
          "cli_flag": "--language"
        }
      ],
      "arg_description": "Language code for processing",
      "default_value": "en"
    },
    {
      "media_urn": "media:max-content-length;textable;numeric",
      "required": false,
      "sources": [
        {
          "cli_flag": "--max-content-length"
        }
      ],
      "arg_description": "Maximum content length to consider (for context window management)",
      "default_value": 2048
    },
    {
      "media_urn": "media:confidence-threshold;textable;numeric",
      "required": false,
      "sources": [
        {
          "cli_flag": "--confidence-threshold"
        }
      ],
      "arg_description": "Minimum confidence threshold for decisions",
      "default_value": 0.7
    },
    {
      "media_urn": "media:model-spec;textable",
      "required": false,
      "sources": [
        {
          "cli_flag": "--model-spec"
        }
      ],
      "arg_description": "Model spec to use for decision making",
      "default_value": "hf:MaziyarPanahi/Mistral-7B-Instruct-v0.3-GGUF?include=*Q8_0*,*.json&exclude=*IQ1*,*IQ2*,*IQ3*,*Q2*,*Q3*"
    }
  ],
  "output": {
    "media_urn": "media:decision;bool;textable;list",
    "output_description": "Array of boolean decision results corresponding to each question"
  }
}